{
  "meta": {
    "nces_id": "170993005092",
    "school_name": "Chicago Math and Science Academy",
    "region": "Illinois",
    "city": "Chicago",
    "state": "IL",
    "grade_band": "6-12",
    "target_region": false,
    "last_updated": "2026-05-12T16:25:23.267784+00:00",
    "data_sources": []
  },
  "enrollment": {
    "year": "2023-24",
    "total": 616,
    "by_grade": null,
    "by_race_ethnicity": {
      "white": 37,
      "black": 257,
      "hispanic": 244,
      "asian": 64,
      "american_indian": null,
      "pacific_islander": null,
      "two_or_more": 10
    },
    "pct_free_reduced_lunch": 90.9,
    "pct_ell": 39.8,
    "pct_sped": 9.4
  },
  "staff": {
    "year": "2023-24",
    "teacher_fte": 45.07,
    "pct_teachers_certified": 97.8,
    "pct_teachers_novice": 6.7,
    "teacher_retention_rate": 82.7
  },
  "assessment": {
    "year": "2023-24",
    "source": "Illinois IAR / SAT",
    "ela": {
      "pct_proficient_all": 33.7,
      "by_grade": {},
      "by_subgroup": {
        "black": 32.3,
        "hispanic": 29.9,
        "white": null,
        "ell": 8.4,
        "sped": 12.5,
        "frl": 31.8
      }
    },
    "math": {
      "pct_proficient_all": 15.1,
      "by_grade": {},
      "by_subgroup": {
        "black": 13.8,
        "hispanic": 14.3,
        "white": null,
        "ell": 2.5,
        "sped": 0.0,
        "frl": 12.4
      }
    },
    "science": {
      "pct_proficient_all": null
    }
  },
  "growth": {
    "year": "2022-23",
    "source": "Illinois ISBE",
    "metric_name": "Student Growth Percentile (SGP)",
    "ela_growth": null,
    "math_growth": null,
    "overall_growth_rating": null
  },
  "graduation": {
    "year": "2023-24",
    "four_year_grad_rate": 87.9,
    "five_year_grad_rate": 92.9,
    "by_subgroup": {
      "black": null,
      "hispanic": null,
      "white": null,
      "ell": null,
      "sped": null,
      "frl": null
    }
  },
  "attendance": {
    "year": "2023-24",
    "avg_daily_attendance_rate": 92.7,
    "chronic_absenteeism_rate": 22.9
  },
  "accountability": {
    "year": "2023-24",
    "state_rating": "Commendable",
    "state_percentile_rank": null,
    "similar_schools_percentile": null
  },
  "trends": {
    "ela_proficiency_by_year": {
      "2021-22": 24.4,
      "2022-23": 28.6,
      "2023-24": 33.7
    },
    "math_proficiency_by_year": {
      "2021-22": 19.0,
      "2022-23": 23.1,
      "2023-24": 15.1
    }
  }
}