{
  "meta": {
    "nces_id": "180006702416",
    "school_name": "Indiana Math and Science Academy West",
    "region": "Indiana",
    "city": "Indianapolis",
    "state": "IN",
    "grade_band": "K-8",
    "target_region": false,
    "last_updated": "2026-05-12T18:15:27.157945+00:00",
    "data_sources": []
  },
  "enrollment": {
    "year": "2023-24",
    "total": 535,
    "by_grade": null,
    "by_race_ethnicity": {
      "white": null,
      "black": null,
      "hispanic": null,
      "asian": null,
      "american_indian": null,
      "pacific_islander": null,
      "two_or_more": null
    },
    "pct_free_reduced_lunch": null,
    "pct_ell": null,
    "pct_sped": null
  },
  "staff": {
    "year": "2022-23",
    "teacher_fte": 49.0,
    "pct_teachers_certified": null,
    "pct_teachers_novice": null,
    "teacher_retention_rate": null
  },
  "assessment": {
    "year": "2023-24",
    "source": "Indiana ILEARN",
    "ela": {
      "pct_proficient_all": 49.4,
      "by_grade": {},
      "by_subgroup": {
        "black": 55.4,
        "hispanic": 34.7,
        "white": null,
        "ell": 60.1,
        "sped": 52.7,
        "frl": 34.4
      }
    },
    "math": {
      "pct_proficient_all": 53.8,
      "by_grade": {},
      "by_subgroup": {
        "black": 57.5,
        "hispanic": 44.6,
        "white": null,
        "ell": 59.5,
        "sped": 57.0,
        "frl": 36.5
      }
    },
    "science": {
      "pct_proficient_all": null
    }
  },
  "growth": {
    "year": null,
    "source": "IN DOE",
    "metric_name": "Indiana School Growth Metric (ILEARN)",
    "ela_growth": null,
    "math_growth": null,
    "overall_growth_rating": null
  },
  "graduation": {
    "year": null,
    "four_year_grad_rate": null,
    "five_year_grad_rate": null,
    "by_subgroup": {
      "black": null,
      "hispanic": null,
      "white": null,
      "ell": null,
      "sped": null,
      "frl": null
    }
  },
  "attendance": {
    "year": null,
    "avg_daily_attendance_rate": null,
    "chronic_absenteeism_rate": null
  },
  "accountability": {
    "year": "2023-24",
    "state_rating": "Meets Expectations",
    "state_percentile_rank": null,
    "similar_schools_percentile": null
  },
  "trends": {
    "ela_proficiency_by_year": {
      "2021-22": 36.2,
      "2022-23": 44.4,
      "2023-24": 49.4
    },
    "math_proficiency_by_year": {
      "2021-22": 40.5,
      "2022-23": 46.7,
      "2023-24": 53.8
    }
  }
}