{
  "meta": {
    "nces_id": "390047005029",
    "school_name": "Horizon Science Academy Cleveland Elementary School",
    "region": "North Ohio",
    "city": "Cleveland",
    "state": "OH",
    "grade_band": "K-8",
    "target_region": false,
    "last_updated": "2026-05-12T18:07:10.563814+00:00",
    "data_sources": []
  },
  "enrollment": {
    "year": "2023-24",
    "total": 198,
    "by_grade": null,
    "by_race_ethnicity": {
      "white": null,
      "black": 198,
      "hispanic": null,
      "asian": null,
      "american_indian": null,
      "pacific_islander": null,
      "two_or_more": null
    },
    "pct_free_reduced_lunch": 100.0,
    "pct_ell": null,
    "pct_sped": 13.1
  },
  "staff": {
    "year": "2023-24",
    "teacher_fte": 20.0,
    "pct_teachers_certified": 100.0,
    "pct_teachers_novice": 20.0,
    "teacher_retention_rate": null
  },
  "assessment": {
    "year": "2023-24",
    "source": "Ohio AIR / Ohio Report Card",
    "ela": {
      "pct_proficient_all": 37.9,
      "by_grade": {},
      "by_subgroup": {
        "black": 37.9,
        "hispanic": null,
        "white": null,
        "ell": null,
        "sped": null,
        "frl": null
      }
    },
    "math": {
      "pct_proficient_all": 17.9,
      "by_grade": {},
      "by_subgroup": {
        "black": 17.9,
        "hispanic": null,
        "white": null,
        "ell": null,
        "sped": null,
        "frl": null
      }
    },
    "science": {
      "pct_proficient_all": 37.0
    }
  },
  "growth": {
    "year": "2023-24",
    "source": "OH DOE",
    "metric_name": "Value-Added Index (VAI)",
    "ela_growth": 2.35,
    "math_growth": 2.35,
    "overall_growth_rating": "4 Stars"
  },
  "graduation": {
    "year": null,
    "four_year_grad_rate": null,
    "five_year_grad_rate": null,
    "by_subgroup": {
      "black": null,
      "hispanic": null,
      "white": null,
      "ell": null,
      "sped": null,
      "frl": null
    }
  },
  "attendance": {
    "year": "2023-24",
    "avg_daily_attendance_rate": 88.4,
    "chronic_absenteeism_rate": null
  },
  "accountability": {
    "year": "2023-24",
    "state_rating": "2 Stars",
    "state_percentile_rank": 53.2,
    "similar_schools_percentile": null
  },
  "trends": {
    "ela_proficiency_by_year": {
      "2021-22": 41.2,
      "2022-23": 38.2,
      "2023-24": 37.9
    },
    "math_proficiency_by_year": {
      "2021-22": 19.9,
      "2022-23": 28.2,
      "2023-24": 17.9
    }
  }
}