{
  "meta": {
    "nces_id": "390132205440",
    "school_name": "Horizon Science Academy Columbus Middle School",
    "region": "Columbus",
    "city": "Columbus",
    "state": "OH",
    "grade_band": "6-8",
    "target_region": false,
    "last_updated": "2026-05-12T18:07:10.548803+00:00",
    "data_sources": []
  },
  "enrollment": {
    "year": "2023-24",
    "total": 438,
    "by_grade": null,
    "by_race_ethnicity": {
      "white": null,
      "black": 399,
      "hispanic": 28,
      "asian": null,
      "american_indian": null,
      "pacific_islander": null,
      "two_or_more": 11
    },
    "pct_free_reduced_lunch": 100.0,
    "pct_ell": 21.1,
    "pct_sped": 11.9
  },
  "staff": {
    "year": "2023-24",
    "teacher_fte": 35.0,
    "pct_teachers_certified": 100.0,
    "pct_teachers_novice": 48.6,
    "teacher_retention_rate": null
  },
  "assessment": {
    "year": "2023-24",
    "source": "Ohio AIR / Ohio Report Card",
    "ela": {
      "pct_proficient_all": 31.3,
      "by_grade": {},
      "by_subgroup": {
        "black": 32.2,
        "hispanic": 18.2,
        "white": null,
        "ell": null,
        "sped": null,
        "frl": null
      }
    },
    "math": {
      "pct_proficient_all": 12.2,
      "by_grade": {},
      "by_subgroup": {
        "black": 12.3,
        "hispanic": 10.0,
        "white": null,
        "ell": null,
        "sped": null,
        "frl": null
      }
    },
    "science": {
      "pct_proficient_all": 18.9
    }
  },
  "growth": {
    "year": "2023-24",
    "source": "OH DOE",
    "metric_name": "Value-Added Index (VAI)",
    "ela_growth": -1.71,
    "math_growth": -1.71,
    "overall_growth_rating": "3 Stars"
  },
  "graduation": {
    "year": null,
    "four_year_grad_rate": null,
    "five_year_grad_rate": null,
    "by_subgroup": {
      "black": null,
      "hispanic": null,
      "white": null,
      "ell": null,
      "sped": null,
      "frl": null
    }
  },
  "attendance": {
    "year": "2023-24",
    "avg_daily_attendance_rate": 89.4,
    "chronic_absenteeism_rate": null
  },
  "accountability": {
    "year": "2023-24",
    "state_rating": "1 Star",
    "state_percentile_rank": 49.9,
    "similar_schools_percentile": null
  },
  "trends": {
    "ela_proficiency_by_year": {
      "2021-22": 35.5,
      "2022-23": 40.6,
      "2023-24": 31.3
    },
    "math_proficiency_by_year": {
      "2021-22": 23.6,
      "2022-23": 17.6,
      "2023-24": 12.2
    }
  }
}