{
  "meta": {
    "nces_id": "180009402487",
    "school_name": "Indiana Math and Science Academy North",
    "region": "Indiana",
    "city": "Indianapolis",
    "state": "IN",
    "grade_band": "K-12",
    "target_region": false,
    "last_updated": "2026-05-08T16:56:27.853122Z",
    "data_sources": []
  },
  "enrollment": {
    "year": "2023-24",
    "total": 600,
    "by_grade": null,
    "by_race_ethnicity": {
      "white": null,
      "black": null,
      "hispanic": null,
      "asian": null,
      "american_indian": null,
      "pacific_islander": null,
      "two_or_more": null
    },
    "pct_free_reduced_lunch": null,
    "pct_ell": null,
    "pct_sped": null
  },
  "staff": {
    "year": "2023-24",
    "teacher_fte": 60.0,
    "pct_teachers_certified": null,
    "pct_teachers_novice": null,
    "teacher_retention_rate": null
  },
  "assessment": {
    "year": null,
    "source": "Indiana ILEARN",
    "ela": {
      "pct_proficient_all": null,
      "by_grade": {},
      "by_subgroup": {
        "black": null,
        "hispanic": null,
        "white": null,
        "ell": null,
        "sped": null,
        "frl": null
      }
    },
    "math": {
      "pct_proficient_all": null,
      "by_grade": {},
      "by_subgroup": {
        "black": null,
        "hispanic": null,
        "white": null,
        "ell": null,
        "sped": null,
        "frl": null
      }
    },
    "science": {
      "pct_proficient_all": null
    }
  },
  "growth": {
    "year": null,
    "source": "IN DOE",
    "metric_name": "Indiana School Growth Metric (ILEARN)",
    "ela_growth": null,
    "math_growth": null,
    "overall_growth_rating": null
  },
  "graduation": {
    "year": null,
    "four_year_grad_rate": null,
    "five_year_grad_rate": null,
    "by_subgroup": {
      "black": null,
      "hispanic": null,
      "white": null,
      "ell": null,
      "sped": null,
      "frl": null
    }
  },
  "attendance": {
    "year": null,
    "avg_daily_attendance_rate": null,
    "chronic_absenteeism_rate": null
  },
  "accountability": {
    "year": null,
    "state_rating": null,
    "state_percentile_rank": null,
    "similar_schools_percentile": null
  },
  "trends": {
    "ela_proficiency_by_year": {
      "2021-22": null,
      "2022-23": null,
      "2023-24": null
    },
    "math_proficiency_by_year": {
      "2021-22": null,
      "2022-23": null,
      "2023-24": null
    }
  }
}