{
  "meta": {
    "nces_id": "260096708048",
    "school_name": "Michigan Math and Science Academy Lorraine",
    "region": "Michigan",
    "city": "Warren",
    "state": "MI",
    "grade_band": "PreK-5",
    "target_region": true,
    "last_updated": "2026-05-12T17:32:50.212970+00:00",
    "data_sources": []
  },
  "enrollment": {
    "year": "2023-24",
    "total": 186,
    "by_grade": null,
    "by_race_ethnicity": {
      "black": 340,
      "hispanic": 0,
      "white": 10,
      "asian": 14,
      "american_indian": 0,
      "pacific_islander": 0,
      "two_or_more": 6
    },
    "pct_free_reduced_lunch": 100.0,
    "pct_ell": 7.9,
    "pct_sped": 12.9
  },
  "staff": {
    "year": "2023-24",
    "teacher_fte": 16.0,
    "pct_teachers_certified": 100.0,
    "pct_teachers_novice": 37.5,
    "teacher_retention_rate": null
  },
  "assessment": {
    "year": "2023-24",
    "source": "Michigan M-STEP",
    "ela": {
      "pct_proficient_all": 20.0,
      "by_grade": {},
      "by_subgroup": {
        "black": 24.0,
        "hispanic": null,
        "white": null,
        "ell": null,
        "sped": null,
        "frl": 14.4
      }
    },
    "math": {
      "pct_proficient_all": 20.0,
      "by_grade": {},
      "by_subgroup": {
        "black": 20.0,
        "hispanic": null,
        "white": null,
        "ell": null,
        "sped": null,
        "frl": 16.0
      }
    },
    "science": {
      "pct_proficient_all": 20.0
    }
  },
  "growth": {
    "year": "2023-24",
    "source": "Michigan MDE",
    "metric_name": "Student Growth Percentile (SGP)",
    "ela_growth": 49.7,
    "math_growth": 39.4,
    "overall_growth_rating": "Below Avg"
  },
  "graduation": {
    "year": null,
    "four_year_grad_rate": null,
    "five_year_grad_rate": null,
    "by_subgroup": {
      "black": null,
      "hispanic": null,
      "white": null,
      "ell": null,
      "sped": null,
      "frl": null
    }
  },
  "attendance": {
    "year": null,
    "avg_daily_attendance_rate": null,
    "chronic_absenteeism_rate": null
  },
  "accountability": {
    "year": "2022-23",
    "state_rating": null,
    "state_percentile_rank": null,
    "similar_schools_percentile": null
  },
  "trends": {
    "ela_proficiency_by_year": {
      "2021-22": 17.8,
      "2022-23": 28.1,
      "2023-24": 20.0
    },
    "math_proficiency_by_year": {
      "2021-22": 20.0,
      "2022-23": 27.6,
      "2023-24": 20.0
    }
  }
}