{
  "meta": {
    "nces_id": "290059203241",
    "school_name": "Gateway Science Academy of St. Louis - South",
    "region": "Missouri",
    "city": "St. Louis",
    "state": "MO",
    "grade_band": "PreK-5",
    "target_region": false,
    "last_updated": "2026-05-12T18:19:33.016354+00:00",
    "data_sources": []
  },
  "enrollment": {
    "year": "2023-24",
    "total": 349,
    "by_grade": null,
    "by_race_ethnicity": {
      "white": 109,
      "black": 168,
      "hispanic": 21,
      "asian": 8,
      "american_indian": null,
      "pacific_islander": null,
      "two_or_more": 42
    },
    "pct_free_reduced_lunch": 73.6,
    "pct_ell": 16.33,
    "pct_sped": 10.32
  },
  "staff": {
    "year": "2023-24",
    "teacher_fte": 29.0,
    "pct_teachers_certified": 88.9,
    "pct_teachers_novice": null,
    "teacher_retention_rate": null
  },
  "assessment": {
    "year": "2023-24",
    "source": "Missouri MAP",
    "ela": {
      "pct_proficient_all": 24.3,
      "by_grade": {},
      "by_subgroup": {
        "black": 0.0,
        "hispanic": 0.0,
        "white": 16.9,
        "ell": null,
        "sped": 27.2,
        "frl": 40.0
      }
    },
    "math": {
      "pct_proficient_all": 29.2,
      "by_grade": {},
      "by_subgroup": {
        "black": 7.6,
        "hispanic": 0.0,
        "white": 0.0,
        "ell": null,
        "sped": 32.9,
        "frl": 34.3
      }
    },
    "science": {
      "pct_proficient_all": 39.6
    }
  },
  "growth": {
    "year": "2022-23",
    "source": "Missouri DESE",
    "metric_name": "Annual Performance Report (APR) Growth Component",
    "ela_growth": null,
    "math_growth": null,
    "overall_growth_rating": null
  },
  "graduation": {
    "year": null,
    "four_year_grad_rate": null,
    "five_year_grad_rate": null,
    "by_subgroup": {
      "black": null,
      "hispanic": null,
      "white": null,
      "ell": null,
      "sped": null,
      "frl": null
    }
  },
  "attendance": {
    "year": "2023-24",
    "avg_daily_attendance_rate": 69.3,
    "chronic_absenteeism_rate": 30.7
  },
  "accountability": {
    "year": "2023-24",
    "state_rating": "Above 5th Percentile",
    "state_percentile_rank": null,
    "similar_schools_percentile": null
  },
  "trends": {
    "ela_proficiency_by_year": {
      "2021-22": 31.1,
      "2022-23": 31.2,
      "2023-24": 24.3
    },
    "math_proficiency_by_year": {
      "2021-22": 17.9,
      "2022-23": 27.4,
      "2023-24": 29.2
    }
  }
}