{
  "meta": {
    "nces_id": "390004202978",
    "school_name": "Horizon Science Academy Columbus High School Morse Road Campus",
    "region": "Columbus",
    "city": "Columbus",
    "state": "OH",
    "grade_band": "9-10",
    "target_region": false,
    "last_updated": "2026-05-12T17:32:50.246953+00:00",
    "data_sources": []
  },
  "enrollment": {
    "year": "2023-24",
    "total": 596,
    "by_grade": null,
    "by_race_ethnicity": {
      "white": 16,
      "black": 515,
      "hispanic": 41,
      "asian": null,
      "american_indian": null,
      "pacific_islander": null,
      "two_or_more": 24
    },
    "pct_free_reduced_lunch": 100.0,
    "pct_ell": 20.0,
    "pct_sped": 10.2
  },
  "staff": {
    "year": "2023-24",
    "teacher_fte": 50.0,
    "pct_teachers_certified": 100.0,
    "pct_teachers_novice": 38.0,
    "teacher_retention_rate": null
  },
  "assessment": {
    "year": "2023-24",
    "source": "Ohio AIR / Ohio Report Card",
    "ela": {
      "pct_proficient_all": 56.5,
      "by_grade": {},
      "by_subgroup": {
        "black": 56.5,
        "hispanic": null,
        "white": null,
        "ell": null,
        "sped": null,
        "frl": null
      }
    },
    "math": {
      "pct_proficient_all": 40.0,
      "by_grade": {},
      "by_subgroup": {
        "black": 41.0,
        "hispanic": 35.7,
        "white": 36.4,
        "ell": null,
        "sped": null,
        "frl": null
      }
    },
    "science": {
      "pct_proficient_all": null
    }
  },
  "growth": {
    "year": "2023-24",
    "source": "OH DOE",
    "metric_name": "Value-Added Index (VAI)",
    "ela_growth": 16.69,
    "math_growth": 16.69,
    "overall_growth_rating": "5 Stars"
  },
  "graduation": {
    "year": "2023-24",
    "four_year_grad_rate": 94.2,
    "five_year_grad_rate": 98.4,
    "by_subgroup": {
      "black": null,
      "hispanic": null,
      "white": null,
      "ell": null,
      "sped": null,
      "frl": null
    }
  },
  "attendance": {
    "year": "2023-24",
    "avg_daily_attendance_rate": 89.0,
    "chronic_absenteeism_rate": null
  },
  "accountability": {
    "year": "2023-24",
    "state_rating": "2 Stars",
    "state_percentile_rank": 67.0,
    "similar_schools_percentile": null
  },
  "trends": {
    "ela_proficiency_by_year": {
      "2021-22": 53.8,
      "2022-23": 55.7,
      "2023-24": 56.5
    },
    "math_proficiency_by_year": {
      "2021-22": 29.9,
      "2022-23": 31.9,
      "2023-24": 40.0
    }
  }
}