{
  "meta": {
    "nces_id": "270039905179",
    "school_name": "Minnesota Math and Science Academy",
    "region": "Minnesota",
    "city": "Saint Paul",
    "state": "MN",
    "grade_band": "K-12",
    "target_region": true,
    "last_updated": "2026-05-12T18:38:34.791335+00:00",
    "data_sources": []
  },
  "enrollment": {
    "year": "2023-24",
    "total": 250,
    "by_grade": null,
    "by_race_ethnicity": {
      "white": null,
      "black": null,
      "hispanic": null,
      "asian": null,
      "american_indian": null,
      "pacific_islander": null,
      "two_or_more": null
    },
    "pct_free_reduced_lunch": null,
    "pct_ell": null,
    "pct_sped": null
  },
  "staff": {
    "year": "2022-23",
    "teacher_fte": 19.0,
    "pct_teachers_certified": null,
    "pct_teachers_novice": null,
    "teacher_retention_rate": null
  },
  "assessment": {
    "year": "2023-24",
    "source": "Minnesota MCA",
    "ela": {
      "pct_proficient_all": 22.8,
      "by_grade": {},
      "by_subgroup": {
        "black": 22.8,
        "hispanic": null,
        "white": null,
        "ell": 22.5,
        "sped": 22.9,
        "frl": 22.9
      }
    },
    "math": {
      "pct_proficient_all": 12.9,
      "by_grade": {},
      "by_subgroup": {
        "black": 12.3,
        "hispanic": null,
        "white": null,
        "ell": 12.4,
        "sped": 12.5,
        "frl": 13.0
      }
    },
    "science": {
      "pct_proficient_all": 5.6
    }
  },
  "growth": {
    "year": "2022-23",
    "source": "Minnesota MDE",
    "metric_name": "Multiple Measurements Rating (MMR)",
    "ela_growth": null,
    "math_growth": null,
    "overall_growth_rating": null
  },
  "graduation": {
    "year": "2023-24",
    "four_year_grad_rate": 77.5,
    "five_year_grad_rate": 84.85,
    "by_subgroup": {
      "black": 77.5,
      "hispanic": null,
      "white": null,
      "ell": 76.92,
      "sped": null,
      "frl": 76.92
    }
  },
  "attendance": {
    "year": "2023-24",
    "avg_daily_attendance_rate": 73.0,
    "chronic_absenteeism_rate": 27.0
  },
  "accountability": {
    "year": "2023-24",
    "state_rating": "Not Identified (Good Standing)",
    "state_percentile_rank": null,
    "similar_schools_percentile": null
  },
  "trends": {
    "ela_proficiency_by_year": {
      "2021-22": 28.6,
      "2022-23": 19.4,
      "2023-24": 22.8
    },
    "math_proficiency_by_year": {
      "2021-22": 14.3,
      "2022-23": 10.0,
      "2023-24": 12.9
    }
  }
}