{
  "meta": {
    "nces_id": "390160605963",
    "school_name": "Horizon Science Academy Columbus Primary School",
    "region": "Columbus",
    "city": "Columbus",
    "state": "OH",
    "grade_band": "K-2",
    "target_region": false,
    "last_updated": "2026-05-12T17:46:34.938829+00:00",
    "data_sources": []
  },
  "enrollment": {
    "year": "2023-24",
    "total": 364,
    "by_grade": null,
    "by_race_ethnicity": {
      "white": 16,
      "black": 324,
      "hispanic": 27,
      "asian": null,
      "american_indian": null,
      "pacific_islander": null,
      "two_or_more": 13
    },
    "pct_free_reduced_lunch": 100.0,
    "pct_ell": 20.0,
    "pct_sped": 10.2
  },
  "staff": {
    "year": "2023-24",
    "teacher_fte": 30.0,
    "pct_teachers_certified": 100.0,
    "pct_teachers_novice": 36.7,
    "teacher_retention_rate": null
  },
  "assessment": {
    "year": "2023-24",
    "source": "Ohio AIR / Ohio Report Card",
    "ela": {
      "pct_proficient_all": null,
      "by_grade": {},
      "by_subgroup": {
        "black": 56.5,
        "hispanic": null,
        "white": null,
        "ell": null,
        "sped": null,
        "frl": null
      }
    },
    "math": {
      "pct_proficient_all": null,
      "by_grade": {},
      "by_subgroup": {
        "black": 41.0,
        "hispanic": 35.7,
        "white": 36.4,
        "ell": null,
        "sped": null,
        "frl": null
      }
    },
    "science": {
      "pct_proficient_all": null
    }
  },
  "growth": {
    "year": "2023-24",
    "source": "OH DOE",
    "metric_name": "Value-Added Index (VAI)",
    "ela_growth": 16.69,
    "math_growth": 16.69,
    "overall_growth_rating": "NC"
  },
  "graduation": {
    "year": null,
    "four_year_grad_rate": null,
    "five_year_grad_rate": null,
    "by_subgroup": {
      "black": null,
      "hispanic": null,
      "white": null,
      "ell": null,
      "sped": null,
      "frl": null
    }
  },
  "attendance": {
    "year": "2023-24",
    "avg_daily_attendance_rate": 90.9,
    "chronic_absenteeism_rate": null
  },
  "accountability": {
    "year": "2023-24",
    "state_rating": "NR",
    "state_percentile_rank": 67.0,
    "similar_schools_percentile": null
  },
  "trends": {
    "ela_proficiency_by_year": {
      "2021-22": null,
      "2022-23": null,
      "2023-24": null
    },
    "math_proficiency_by_year": {
      "2021-22": null,
      "2022-23": null,
      "2023-24": null
    }
  }
}